[
  {
    "id": "weizmann-100-2026",
    "source": "university",
    "source_url": "https://www.weizmann.ac.il/michrazim/sites/michrazim/files/tenders/%D7%9E%D7%A1%D7%9E%D7%9B%D7%99%20%D7%9E%D7%9B%D7%A8%D7%96_4.pdf",
    "title": "מכרז פומבי מספר 100/2026 למתן שירותי הפקה, צילום הקלטה, עריכה וניהול תוכן למדיה דיגיטלית אודיו ו/או וידיאו למכון ויצמן למדע",
    "buyer": "מכון ויצמן למדע",
    "buyer_type": "university",
    "procedure_no": "100/2026",
    "kind": "tender",
    "deadline_at": "2026-08-24T12:00",
    "status": "closed",
    "scope_summary": "הפקה, צילום, הקלטה ועריכה של תוכן וידאו ואודיו דיגיטלי למכון ויצמן.",
    "crafts": [
      "film-production",
      "editing",
      "sound-design",
      "content-studio"
    ],
    "keywords_matched": [
      "הפקה",
      "צילום",
      "עריכה"
    ],
    "last_checked_at": "2026-10-20",
    "added": "2026-10-20"
  },
  {
    "id": "mr-4000623022",
    "source": "mr.gov.il",
    "source_url": "https://mr.gov.il/ilgstorefront/he/p/4000623022",
    "title": "להפקת אירועי הרמת מסך לשנת 2027",
    "buyer": "משרד המדע התרבות והספורט",
    "buyer_type": "ministry",
    "kind": "tender",
    "published_at": "2026-10-19",
    "deadline_at": "2026-11-15T12:00",
    "status": "open",
    "scope_summary": "הפקת אירועי ״הרמת מסך״ של משרד התרבות לשנת 2027.",
    "crafts": [
      "experiential"
    ],
    "keywords_matched": [
      "הפקת",
      "אירועים"
    ],
    "submission_url": "https://quickbid.gpa.gov.il",
    "last_checked_at": "2026-10-20",
    "added": "2026-10-20"
  },
  {
    "id": "mr-4000622905",
    "source": "mr.gov.il",
    "source_url": "https://mr.gov.il/ilgstorefront/he/p/4000622905",
    "title": "מכרז 31/2026 למתן שירותי תכלול וייעוץ בתחומי אסטרטגיה, מדיה והפקה עבור משרד החוץ אגף דיפלומטיה ציבורית",
    "buyer": "משרד החוץ",
    "buyer_type": "ministry",
    "procedure_no": "31/2026",
    "kind": "tender",
    "published_at": "2026-10-18",
    "deadline_at": "2026-11-15T12:00",
    "status": "open",
    "scope_summary": "תכלול, אסטרטגיה, מדיה והפקה לפעילות ההסברה של משרד החוץ בעולם.",
    "crafts": [
      "commercial-production",
      "content-studio"
    ],
    "keywords_matched": [
      "הפקה",
      "מדיה",
      "הסברה"
    ],
    "submission_url": "https://quickbid.gpa.gov.il",
    "last_checked_at": "2026-10-20",
    "added": "2026-10-20"
  },
  {
    "id": "mr-4000622386",
    "source": "mr.gov.il",
    "source_url": "https://mr.gov.il/ilgstorefront/he/p/4000622386",
    "title": "מכרז 17/26 למתן שירותי הפקה וליווי קמפיינים",
    "buyer": "לשכת הפרסום הממשלתית (לפ\"מ)",
    "buyer_type": "ministry",
    "buyer_org_id": "lapam",
    "procedure_no": "17/26",
    "kind": "tender",
    "published_at": "2026-10-05",
    "deadline_at": "2026-11-02T12:00",
    "status": "open",
    "scope_summary": "חברות הפקה לקמפיינים ממשלתיים: הפקת סרטים ותוכן לקמפיינים של משרדי הממשלה, וליווי ההפקה.",
    "crafts": [
      "commercial-production",
      "film-production",
      "content-studio"
    ],
    "keywords_matched": [
      "הפקה",
      "קמפיינים"
    ],
    "submission_url": "https://quickbid.gpa.gov.il",
    "last_checked_at": "2026-10-20",
    "added": "2026-10-20"
  }
]
